CODEBUCH,
"Im Codebuch definieren Sie, wie und nach welchen Kriterien erfasst werden.",
Quelle: Drucksache 19/28000  https://dserver.bundestag.de/btd/19/280/1928000.pdf,
Wert,Kommentar
edgelist,Grundregel: Die Edgelist darf pro Spalte immer nur einen Wert enthalten. Bis auf die ID idealerweise numerisch codiert (als Zahl).
from,definiert den Sender der Spende
to ,definiert den Empfänger der Spende 
donation,"Höhe der Spende, gerundet und geteilt durch 1000"
weight,"Kleinspende=1, Großspende=2, Erbnachlass=3"
,
nodelist,Grundregel: die IDs der Nodelist müssen mit den IDs der Edgelist komplett übereinstimmen. Ausprägungen der Attribute in der Regel numerisch definieren.
id,"eindeutige Identifikation jedes einzelnen Knotens (vertex), der erfasst wird.  "
name,Name oder Bezeichnung des Knotens
state,Bundesland des Spenders
zip code,Registrierte Postleitzahl des Spenders
town,Registrierter Wohnort des Spenders
type,"Art des Spenders, also natürliche Person (1), juristische Person (2) oder Partei (3) oder Jahr der eingegangenen Spende (4)"
member,Mitglied der AfD: ja (1) oder nein (2)?
gender,"Geschlecht des Spenders (Mann=1, Frau=2)"
NA,"definiert fehlende Werte, bei der Datenerhebung das Feld einfach leer lassen, R rechnet NAs (missing values) automatisch raus.."
Bearbeitungshinweise,
"Achten Sie bitte auf die Kommentare in den Spalten. Diese erklären genauer, welche Daten erfasst werden. ",
"Sie sehen die Kommentare, wenn Sie auf die entsprechende Spalte gehen. ",
"Skizzieren Sie zunächst Ihr Netzwerk bzw. die Daten, die für Sie relevant sind. ",
Welche Informationen wollen Sie erheben? Wie müssen diese erfasst sein?,
"Legen Sie bitte im Codebuch möglichst genau fest, wie die Daten erhoben werden (Codebuch)",
"Bitte verwenden Sie keine Sonderzeichen in der Erfassung, dazu gehören Satzzeichen, Umlaute, etc.",
"Verpflichten Sie alle Teammitglieder darauf, das Codebuch zwingend einzuhalten. ",
Wer seine Daten nicht sauber erstellt muss diese nachbereinigen.,
"Dokumentieren Sie jeden Schritt Ihrer Datenerfassung mit, um dies zu rekonstruieren.",
Nutzen Sie das Skript zur Datenbereinigung auf dem letzten Reiter!,
"Beispiel für die Dokumentation von Codebuch, Edge- und Nodelist",
https://github.com/hdm-crpr/226305/tree/master/data/crpr2,
Vergeben Sie stets eindeutige Spaltenbeschriftungen. Am besten immer nur ein Begriff ohne Sonderzeichen etc.,